{"active_behavior_authorization":false,"behavior_catalog_ref":{"document_id":"adaptive_runtime_effective_behavior_catalog_v3","schema_version":"adaptive-runtime-effective-behavior-catalog-v3","document_version":3,"content_sha256":"c7cb2d1c39f6ba02bd631a214e62769ec1e099d1ef3abb03db315d38c2ef5db8"},"binary_cohort_id":"binary_cohort.run.send_admission_composition.correctness.a4","binary_cohort_ref":{"document_id":"binary_cohort.run.send_admission_composition.correctness.a4","schema_version":"adaptive-runtime-binary-cohort-v1","document_version":1,"content_sha256":"9d18405c184a1c34dac69f45a16d5295c81b5b919cfb48b333140e11e9f8c7bc"},"connection_epochs":[{"connection_key":"connection.send_admission_composition.correctness.a4.batch","epoch_sequence":1,"run_id":"run.send_admission_composition.correctness.a4"},{"connection_key":"connection.send_admission_composition.correctness.a4.buffer","epoch_sequence":1,"run_id":"run.send_admission_composition.correctness.a4"},{"connection_key":"connection.send_admission_composition.correctness.a4.oversized","epoch_sequence":1,"run_id":"run.send_admission_composition.correctness.a4"}],"connection_key":"connection.send_admission_composition.correctness.a4","content_sha256":"83cfd7632ba282a42f8b12bdcee295b9fb0b543b0efe125d4f155a210098f252","decisions":[{"applied_value":"legacy_current","axis_id":"application_send_batch_formation","candidate_value":"legacy_current","configured_value":"legacy_current","connection_key":"connection.send_admission_composition.correctness.a4.batch","decision_instance_id":10,"epoch_sequence":1,"forced_value":"legacy_current","operation_eligibility_reason":"eligible","operation_eligibility_result":"eligible","run_id":"run.send_admission_composition.correctness.a4","shadow_recommendation":null},{"applied_value":"legacy_current","axis_id":"buffer_copy_coalescing","candidate_value":"legacy_current","configured_value":"legacy_current","connection_key":"connection.send_admission_composition.correctness.a4.buffer","decision_instance_id":1,"epoch_sequence":1,"forced_value":"legacy_current","operation_eligibility_reason":"eligible","operation_eligibility_result":"eligible","run_id":"run.send_admission_composition.correctness.a4","shadow_recommendation":null},{"applied_value":"single_fragment","axis_id":"oversized_write_admission_quantum","candidate_value":"single_fragment","configured_value":"legacy_current","connection_key":"connection.send_admission_composition.correctness.a4.oversized","decision_instance_id":1,"epoch_sequence":1,"forced_value":"single_fragment","operation_eligibility_reason":"legal_fragment_count_gt_one","operation_eligibility_result":"eligible","run_id":"run.send_admission_composition.correctness.a4","shadow_recommendation":null}],"document_id":"operation_evidence.run.send_admission_composition.correctness.a4","document_version":4,"epoch_sequence":1,"experiment_run_ref":{"document_id":"experiment_run.run.send_admission_composition.correctness.a4","schema_version":"adaptive-runtime-experiment-run-v1","document_version":1,"content_sha256":"b75ab60f442b15968c294650cfa340ffad869c3bbc490963cf1548cda4fc9800"},"operations":[{"applied_bytes":32768,"applied_value":"single_fragment","applied_work_count":1,"axis_id":"oversized_write_admission_quantum","candidate_value":"single_fragment","configured_value":"legacy_current","connection_key":"connection.send_admission_composition.correctness.a4.oversized","decision_instance_id":1,"epoch_sequence":1,"fallback_or_safety_reason":null,"forced_value":"single_fragment","legal_bytes":163840,"legal_work_count":5,"mechanism_event_id":"mechanism_event.oversized_write.one_fragment_per_turn","operation_eligibility_reason":"legal_fragment_count_gt_one","operation_eligibility_result":"eligible","operation_id":1,"operation_kind":"logical_write","result":"applied","run_id":"run.send_admission_composition.correctness.a4","scope_version":1,"shadow_recommendation":null,"terminal_outcome":"completed"},{"applied_bytes":400,"applied_value":"legacy_current","applied_work_count":4,"axis_id":"buffer_copy_coalescing","candidate_value":"legacy_current","configured_value":"legacy_current","connection_key":"connection.send_admission_composition.correctness.a4.buffer","decision_instance_id":1,"epoch_sequence":1,"fallback_or_safety_reason":null,"forced_value":"legacy_current","legal_bytes":400,"legal_work_count":4,"mechanism_event_id":"mechanism_event.buffer_legacy_prefix","operation_eligibility_reason":"eligible","operation_eligibility_result":"eligible","operation_id":1,"operation_kind":"combined_send","result":"applied","run_id":"run.send_admission_composition.correctness.a4","scope_version":1,"shadow_recommendation":null,"terminal_outcome":"released"},{"applied_bytes":406,"applied_value":"legacy_current","applied_work_count":4,"axis_id":"application_send_batch_formation","candidate_value":"legacy_current","configured_value":"legacy_current","connection_key":"connection.send_admission_composition.correctness.a4.batch","decision_instance_id":10,"epoch_sequence":1,"fallback_or_safety_reason":null,"forced_value":"legacy_current","legal_bytes":406,"legal_work_count":4,"mechanism_event_id":"mechanism_event.batch_legal_prefix","operation_eligibility_reason":"eligible","operation_eligibility_result":"eligible","operation_id":10,"operation_kind":"packet_plan","result":"applied","run_id":"run.send_admission_composition.correctness.a4","scope_version":1,"shadow_recommendation":null,"terminal_outcome":"packet_plan_committed"}],"performance_acceptance_authorization":false,"plan_validation_ref":{"document_id":"validation.adaptive_runtime_send_admission_correctness_plan_v1","schema_version":"adaptive-runtime-send-admission-plan-validation-v1","document_version":1,"content_sha256":"079d0d391d33b26dbffb8b5e1facafd65e1975f31c01a575ec24ca1eacd9e17d"},"releases":[{"axis_id":"buffer_copy_coalescing","connection_key":"connection.send_admission_composition.correctness.a4.buffer","decision_epoch_sequence":1,"decision_instance_id":1,"operation_epoch_sequence":1,"operation_id":1,"release_count":1,"release_epoch_sequence":1,"run_id":"run.send_admission_composition.correctness.a4","terminal_outcome":"released"}],"result_epoch_sequence":1,"run_id":"run.send_admission_composition.correctness.a4","schema_version":"adaptive-runtime-operation-evidence-v4","trace_references":{"architecture_ids":["ARC-QUIC-CRT-0116"],"requirement_ids":["REQ-QUIC-CRT-0241","REQ-QUIC-CRT-0242","REQ-QUIC-CRT-0243","REQ-QUIC-CRT-0244","REQ-QUIC-CRT-0245","REQ-QUIC-CRT-0246"],"verification_ids":["VER-QUIC-CRT-0118"],"work_item_ids":["WI-QUIC-CRT-0117"]}}